id,question
176,What is the expected next action for the fire truck? A. Stay in lane. B. Lane change to the left. C. Lane change to the right. D. Stop.
177,In which direction can you proceed at the intersection? A. Straight. B. Left. C. Right. D. All of the Above
178,In what direction is the bicyclist travelling? A. Same direction as ego. B. Opposite direction from ego. C. From left to right. D. From right to left.
179,How is the car in front driving? A. Making a left lane change. B. Making a right lane change. C. Staying in lane. D. Parking.
180,What is the color and shape of the traffic light relevant to ego's current lane? A. Green Left Arrow. B. Green Right Arrow. C. Green Circle. D. Red Right Arrow.
181,What is the correct thing to do at the upcoming traffic light? A. Come to a complete stop. B. Proceed as if a green light. C. Proceed with caution. D. Speed up.
182,Why would it be inappropriate for ego to turn left? A. There is a no left turn sign. B. The road to the left is blocked by construction. C. The road to the left is blocked by a vehicle. D. The road to the left is a railroad.
183,What is the intent of the vehicle on the oncoming side of the road? A. Continue straight. B. Right turn. C. Left turn. D. Park.
184,How many cars are in the left turn lane ahead of ego? A. 0. B. 1. C. 2. D. 3.
185,Ego's navigation route is to go straight at this intersection. What is the best action for ego in this situation? A. Turn left. B. Go straight. C. Turn right. D. Reverse.
186,How many drivable lanes are travelling in ego's direction on ego's current road? A. 1. B. 2. C. 3. D. 4.
187,What does the sign on the right say? A. No left turn. B. No U-turn. C. No left turn or U-turn. D. No right turn.
188,What are the valid maneuvers through the intersection for ego's current lane? A. Straight only. B. Left turn only. C. Left turn and straight. D. Right turn only.
189,What is the slope of the road ego is traversing? A. Uphill. B. Downhill. C. Flat. D. Bumpy.
190,Why does ego need to slow down? A. Light turned yellow. B. Light turned red. C. Yielding for a pedestrian. D. Speedbump ahead.
191,"Is the adjacent truck about to lane change in front of us? A. Yes definitely. B. Possibly but we should yield to be safe. C. No the adjacent truck is about to lane change behind us. D. No, there are no other vehicles in the scene."
192,What color is the traffic light that is flashing? A. Green. B. Yellow. C. Red. D. Blue.
193,What is the blinker state of the car in front of ego? A. Right signal light on. B. Left signal light on. C. Blinkers are off. D. Hazard lights are on.
194,How many flashing light bulbs are there? A. 1. B. 2. C. 3. D. 4.
195,What is the best course of action for ego in this situation? A. Continue driving straight normally. B. Stop or pullover. C. Accelerate. D. Honk.
196,How many lanes are blocked off by construction? A. 0. B. 1. C. 2. D. 3.
197,What direction was the moving car traversing in during the video? A. Left to right. B. Right to left. C. Same direction as ego. D. Opposite direction from ego.
198,What is the correct behavior for ego at the upcoming intersection? A. Continue at the same speed. B. Slow down but do not come to a stop. C. Come to a stop. D. Speed up.
199,"At the upcoming intersection, how many lanes support a drive straight maneuver? A. 5. B. 4. C. 3. D. 2."
200,What are the legal maneuvers through the intersection in ego's current lane? A. Turn left only. B. Turn right only. C. Turn left and go straight. D. Turn right and go straight.
201,What is the color and shape of the traffic light closest to ego? A. Red Circle. B. Red Right Arrow. C. Red Left Arrow. D. Yellow Circle. E. Yellow Left Arrow.
202,What directions of travel are legal from ego's current lane? A. Left only. B. Straight or Left. C. Straight only. D. Right only.
203,What best describes the cones in this scene? A. The cones block ego's path forward. B. The cones block ego's path to the right. C. The cones block ego's path to the left. D. The cones do not block ego's path.
204,How many lanes turn right at the intersection ahead? A. 1. B. 2. C. 3. D. 4.
205,What lane should ego be in to take the 290 East? A. Right most lane. B. Center lanes. C. Left most lane. D. Any lane.
206,How many stop signs are facing ego and relevant to ego for the intersection ahead? A. 1. B. 2. C. 3. D. 4.
207,What material is ego's right wheel driving over? A. Grass. B. Concrete. C. Sand. D. Rocks.
208,"In order to complete a left turn at the upcoming intersection, what does ego need to do? A. Stay in the current lane. B. Lane change to the left, looking out for the traffic light. C. Lane change to the left, looking out for the bollards. D. Lane change to the right."
209,Can you enter the 805 Highway Northbound from the current lane? A. Yes. B. No. C. Insufficient information. D. None of the above.
210,Why does ego come to a stop? A. stop sign. B. red light. C. closed gate. D. river
211,How many lanes are able to take exit 289? A. 1. B. 2. C. 3. D. 4.
212,Which is not true about the scene. A. Ego is not allowed to turn left at this intersection. B. There are bicyclists in ego's lane. C. There are bollards to ego's left. D. Ego's lane has a green light.
213,How many lanes in the direction of ego are there on the road? A. 5. B. 6. C. 7. D. 8.
214,What is the speed limit on this road? A. 15mph. B. 25mph. C. 35mph. D. None of the above.
215,What maneuvers can ego do from the current lane? A. Go straight only. B. Turn left only. C. Turn right only. D. U-turn only.
216,Why is traffic slowing down? A. low visibility. B. road work. C. Parking. D. drop off.
217,How many lanes can you proceed straight from at the next intersection? A. 0. B. 1. C. 2.
218,How many lanes in the direction of ego are there for the intersection ahead? A. 3. B. 4. C. 5. D. 6.
219,Can ego legally and safely make a right lane change now? A. yes because the right lane is empty. B. No because there is no right lane. C. No because of the solid white lines in between. D. No because ego is moving too fast.
220,Why is ego slowing down? A. Stop Sign. B. Pedestrian. C. Red Traffic Light. D. Pothole.
221,How far is the exit to South Lockhart? A. 1/4 mile. B. 1/2 mile. C. 3/4 mile. D. 1 mile.
222,What are the available maneuvers through the intersection for ego's current lane? A. Turn left only. B. Turn right only. C. Turn left and go straight. D. Turn right and go straight.
223,What is the state of the traffic light ahead? A. Solid red. B. Blinking red. C. Solid green. D. Blinking green.
224,What obstacle is in front of ego? A. Tree branch. B. Traffic cone. C. Cardboard box. D. Scooter.
225,Describe the intention of the oncoming car. A. Intends to go straight. B. Will reverse. C. Is parked. D. Will turn left.
226,"On the road ahead, which lane is closed by construction? A. The lane to ego's left. B. Ego's lane. C. The lane to ego's right. D. None of the above."
227,What occured at the end of the video that ego should watch out for? A. Oncoming vehicle swerved into our lane. B. Traffic light turned yellow. C. Pedestrian jumped in ego's way. D. Open car door.
228,"The time now is 7:30pm. Would it be appropriate for ego to turn left at the intersection ahead and why? A. Yes, there is a road to the left of ego. B. No, the road is blocked by construction. C. No, the road is blocked by a bus. D. No, there is a no left turn sign."
229,In front of you is a one way road. Which direction does traffic go on this road? A. Left. B. Right.
230,What is ego's immediate most likely action? A. Turn left. B. Go straight. C. Turn right. D. Stop.
231,How do we get on highway 27? A. Lane change to the left. B. Stay on the current lane. C. Lane change to the right. D. Insufficient information to tell.
232,"Which of the following is a valid, legal and safe driving maneuver? A. Stop. B. Turn Right. C. Proceed Straight. D. Turn Left."
233,How many lanes are present on ego's current road in the direction of ego's travel? A. 1. B. 2. C. 3. D. 4.
234,How many unique vehicles cross in front of ego and exit the video frame? A. 0. B. 1. C. 2. D. 3.
235,"From the current lane, what maneuvers can ego do legally from the provided options? A. Go straight only. B. Go straight and turn left. C. Go straight and turn right. D. Go straight, turn left and turn right."
236,How many car lanes are present on ego's current road in the direction of ego's travel? A. 1. B. 2. C. 3. D. 4.
237,Why should ego slow down? A. For the stop sign. B. For the pedestrian. C. For the turn ahead. D. For a red light.
238,What is the speed limit of the road that ego's currently on? A. 65mph. B. 45mph. C. 35mph. D. 25mph.
239,Why does ego need to slow down? A. Red light ahead. B. Stopped traffic ahead. C. No need to slow down. D. Pedestrian crossing.
240,How many lanes are travelling in ego's direction? A. 2. B. 3. C. 4. D. 6.
241,What is the green-colored item on the road in front of ego? A. Some tape on the ground. B. A toy car. C. A car jack. D. A trolley.
242,How many lanes are traveling in the same direction as ego? A. 2. B. 3. C. 4. D. 5.
243,Why is it inappropriate for ego to drive straight? A. There are cones blocking ego's path. B. There is a car facing ego ahead. C. There is a tree ahead. D. There is a do not enter sign.
244,What is the speed limit relevant to ego? A. 35. B. 30. C. 25. D. 45.
245,The flashing sign ahead indicates ego should perform what maneuver? A. Stop ahead. B. Right lane change ahead. C. No action required. D. Left lane change ahead.
246,What should ego do at this intersection? A. Turn left. B. Go straight. C. Turn right.
247,Count the number of unique pedestrians seen by the ego. A. 0. B. 1. C. 2. D. 3. E. 4.
248,Why did ego stop? A. Stop sign. B. Blocked path. C. Wait for pedestrian. D. Red light.
249,Which description below is correct if ego wants to turn right at the Anza street ahead? A. Ego should directly turn right from the current lane because the right lane is an HOV lane. B. Ego should immediately lane change to the right lane and then turn right. C. Ego can't lane change to the right lane because that is an HOV lane. D. Ego should proceed through this intersection as it's not Anza street yet.
250,What is the speed limit of the road straight in front of ego? A. 25. B. 30. C. 35. D. 40.
251,What best describes the type of intersection ego is at? A. All way stop. B. Traffic light controlled. C. T-junction. D. Roundabout.